<?xml version="1.0" encoding="UTF-8"?>
<dataroot xmlns:od="urn:schemas-microsoft-com:officedata" xmlns:xsi="http://www.w3.org/2001/XMLSchema-instance"  xsi:noNamespaceSchemaLocation="32_CodebookOptionMap.xsd" generated="2026-02-26T10:31:51">
<_x0033_2_CodebookOptionMap>
<CodebookCompID>101</CodebookCompID>
<CodebookID>26</CodebookID>
<OptionID>101</OptionID>
<OptionPosition>1</OptionPosition>
<OptionValue>0</OptionValue>
</_x0033_2_CodebookOptionMap>
<_x0033_2_CodebookOptionMap>
<CodebookCompID>102</CodebookCompID>
<CodebookID>26</CodebookID>
<OptionID>102</OptionID>
<OptionPosition>2</OptionPosition>
<OptionValue>1</OptionValue>
</_x0033_2_CodebookOptionMap>
<_x0033_2_CodebookOptionMap>
<CodebookCompID>103</CodebookCompID>
<CodebookID>26</CodebookID>
<OptionID>103</OptionID>
<OptionPosition>3</OptionPosition>
<OptionValue>2</OptionValue>
</_x0033_2_CodebookOptionMap>
<_x0033_2_CodebookOptionMap>
<CodebookCompID>104</CodebookCompID>
<CodebookID>26</CodebookID>
<OptionID>104</OptionID>
<OptionPosition>4</OptionPosition>
<OptionValue>3</OptionValue>
</_x0033_2_CodebookOptionMap>
<_x0033_2_CodebookOptionMap>
<CodebookCompID>105</CodebookCompID>
<CodebookID>27</CodebookID>
<OptionID>106</OptionID>
<OptionPosition>1</OptionPosition>
<OptionValue>0</OptionValue>
</_x0033_2_CodebookOptionMap>
<_x0033_2_CodebookOptionMap>
<CodebookCompID>106</CodebookCompID>
<CodebookID>27</CodebookID>
<OptionID>107</OptionID>
<OptionPosition>2</OptionPosition>
<OptionValue>1</OptionValue>
</_x0033_2_CodebookOptionMap>
<_x0033_2_CodebookOptionMap>
<CodebookCompID>107</CodebookCompID>
<CodebookID>27</CodebookID>
<OptionID>108</OptionID>
<OptionPosition>3</OptionPosition>
<OptionValue>2</OptionValue>
</_x0033_2_CodebookOptionMap>
<_x0033_2_CodebookOptionMap>
<CodebookCompID>108</CodebookCompID>
<CodebookID>27</CodebookID>
<OptionID>109</OptionID>
<OptionPosition>4</OptionPosition>
<OptionValue>3</OptionValue>
</_x0033_2_CodebookOptionMap>
<_x0033_2_CodebookOptionMap>
<CodebookCompID>1</CodebookCompID>
<CodebookID>1</CodebookID>
<OptionID>1</OptionID>
<OptionPosition>1</OptionPosition>
<OptionValue>0</OptionValue>
</_x0033_2_CodebookOptionMap>
<_x0033_2_CodebookOptionMap>
<CodebookCompID>2</CodebookCompID>
<CodebookID>1</CodebookID>
<OptionID>2</OptionID>
<OptionPosition>2</OptionPosition>
<OptionValue>1</OptionValue>
</_x0033_2_CodebookOptionMap>
<_x0033_2_CodebookOptionMap>
<CodebookCompID>3</CodebookCompID>
<CodebookID>1</CodebookID>
<OptionID>3</OptionID>
<OptionPosition>3</OptionPosition>
<OptionValue>2</OptionValue>
</_x0033_2_CodebookOptionMap>
<_x0033_2_CodebookOptionMap>
<CodebookCompID>4</CodebookCompID>
<CodebookID>1</CodebookID>
<OptionID>4</OptionID>
<OptionPosition>4</OptionPosition>
<OptionValue>3</OptionValue>
</_x0033_2_CodebookOptionMap>
<_x0033_2_CodebookOptionMap>
<CodebookCompID>5</CodebookCompID>
<CodebookID>2</CodebookID>
<OptionID>5</OptionID>
<OptionPosition>1</OptionPosition>
<OptionValue>0</OptionValue>
</_x0033_2_CodebookOptionMap>
<_x0033_2_CodebookOptionMap>
<CodebookCompID>6</CodebookCompID>
<CodebookID>2</CodebookID>
<OptionID>6</OptionID>
<OptionPosition>2</OptionPosition>
<OptionValue>1</OptionValue>
</_x0033_2_CodebookOptionMap>
<_x0033_2_CodebookOptionMap>
<CodebookCompID>7</CodebookCompID>
<CodebookID>2</CodebookID>
<OptionID>7</OptionID>
<OptionPosition>3</OptionPosition>
<OptionValue>2</OptionValue>
</_x0033_2_CodebookOptionMap>
<_x0033_2_CodebookOptionMap>
<CodebookCompID>8</CodebookCompID>
<CodebookID>2</CodebookID>
<OptionID>8</OptionID>
<OptionPosition>4</OptionPosition>
<OptionValue>3</OptionValue>
</_x0033_2_CodebookOptionMap>
<_x0033_2_CodebookOptionMap>
<CodebookCompID>9</CodebookCompID>
<CodebookID>3</CodebookID>
<OptionID>9</OptionID>
<OptionPosition>1</OptionPosition>
<OptionValue>0</OptionValue>
</_x0033_2_CodebookOptionMap>
<_x0033_2_CodebookOptionMap>
<CodebookCompID>10</CodebookCompID>
<CodebookID>3</CodebookID>
<OptionID>10</OptionID>
<OptionPosition>2</OptionPosition>
<OptionValue>1</OptionValue>
</_x0033_2_CodebookOptionMap>
<_x0033_2_CodebookOptionMap>
<CodebookCompID>11</CodebookCompID>
<CodebookID>3</CodebookID>
<OptionID>11</OptionID>
<OptionPosition>3</OptionPosition>
<OptionValue>2</OptionValue>
</_x0033_2_CodebookOptionMap>
<_x0033_2_CodebookOptionMap>
<CodebookCompID>12</CodebookCompID>
<CodebookID>3</CodebookID>
<OptionID>12</OptionID>
<OptionPosition>4</OptionPosition>
<OptionValue>3</OptionValue>
</_x0033_2_CodebookOptionMap>
<_x0033_2_CodebookOptionMap>
<CodebookCompID>13</CodebookCompID>
<CodebookID>4</CodebookID>
<OptionID>13</OptionID>
<OptionPosition>1</OptionPosition>
<OptionValue>0</OptionValue>
</_x0033_2_CodebookOptionMap>
<_x0033_2_CodebookOptionMap>
<CodebookCompID>14</CodebookCompID>
<CodebookID>4</CodebookID>
<OptionID>14</OptionID>
<OptionPosition>2</OptionPosition>
<OptionValue>1</OptionValue>
</_x0033_2_CodebookOptionMap>
<_x0033_2_CodebookOptionMap>
<CodebookCompID>15</CodebookCompID>
<CodebookID>4</CodebookID>
<OptionID>15</OptionID>
<OptionPosition>3</OptionPosition>
<OptionValue>2</OptionValue>
</_x0033_2_CodebookOptionMap>
<_x0033_2_CodebookOptionMap>
<CodebookCompID>16</CodebookCompID>
<CodebookID>4</CodebookID>
<OptionID>16</OptionID>
<OptionPosition>4</OptionPosition>
<OptionValue>3</OptionValue>
</_x0033_2_CodebookOptionMap>
<_x0033_2_CodebookOptionMap>
<CodebookCompID>17</CodebookCompID>
<CodebookID>5</CodebookID>
<OptionID>17</OptionID>
<OptionPosition>1</OptionPosition>
<OptionValue>0</OptionValue>
</_x0033_2_CodebookOptionMap>
<_x0033_2_CodebookOptionMap>
<CodebookCompID>18</CodebookCompID>
<CodebookID>5</CodebookID>
<OptionID>18</OptionID>
<OptionPosition>2</OptionPosition>
<OptionValue>1</OptionValue>
</_x0033_2_CodebookOptionMap>
<_x0033_2_CodebookOptionMap>
<CodebookCompID>19</CodebookCompID>
<CodebookID>5</CodebookID>
<OptionID>19</OptionID>
<OptionPosition>3</OptionPosition>
<OptionValue>2</OptionValue>
</_x0033_2_CodebookOptionMap>
<_x0033_2_CodebookOptionMap>
<CodebookCompID>20</CodebookCompID>
<CodebookID>5</CodebookID>
<OptionID>20</OptionID>
<OptionPosition>4</OptionPosition>
<OptionValue>3</OptionValue>
</_x0033_2_CodebookOptionMap>
<_x0033_2_CodebookOptionMap>
<CodebookCompID>21</CodebookCompID>
<CodebookID>6</CodebookID>
<OptionID>21</OptionID>
<OptionPosition>1</OptionPosition>
<OptionValue>0</OptionValue>
</_x0033_2_CodebookOptionMap>
<_x0033_2_CodebookOptionMap>
<CodebookCompID>22</CodebookCompID>
<CodebookID>6</CodebookID>
<OptionID>22</OptionID>
<OptionPosition>2</OptionPosition>
<OptionValue>1</OptionValue>
</_x0033_2_CodebookOptionMap>
<_x0033_2_CodebookOptionMap>
<CodebookCompID>23</CodebookCompID>
<CodebookID>6</CodebookID>
<OptionID>23</OptionID>
<OptionPosition>3</OptionPosition>
<OptionValue>2</OptionValue>
</_x0033_2_CodebookOptionMap>
<_x0033_2_CodebookOptionMap>
<CodebookCompID>24</CodebookCompID>
<CodebookID>6</CodebookID>
<OptionID>24</OptionID>
<OptionPosition>4</OptionPosition>
<OptionValue>3</OptionValue>
</_x0033_2_CodebookOptionMap>
<_x0033_2_CodebookOptionMap>
<CodebookCompID>25</CodebookCompID>
<CodebookID>7</CodebookID>
<OptionID>25</OptionID>
<OptionPosition>1</OptionPosition>
<OptionValue>0</OptionValue>
</_x0033_2_CodebookOptionMap>
<_x0033_2_CodebookOptionMap>
<CodebookCompID>26</CodebookCompID>
<CodebookID>7</CodebookID>
<OptionID>26</OptionID>
<OptionPosition>2</OptionPosition>
<OptionValue>1</OptionValue>
</_x0033_2_CodebookOptionMap>
<_x0033_2_CodebookOptionMap>
<CodebookCompID>27</CodebookCompID>
<CodebookID>7</CodebookID>
<OptionID>27</OptionID>
<OptionPosition>3</OptionPosition>
<OptionValue>2</OptionValue>
</_x0033_2_CodebookOptionMap>
<_x0033_2_CodebookOptionMap>
<CodebookCompID>28</CodebookCompID>
<CodebookID>7</CodebookID>
<OptionID>28</OptionID>
<OptionPosition>4</OptionPosition>
<OptionValue>3</OptionValue>
</_x0033_2_CodebookOptionMap>
<_x0033_2_CodebookOptionMap>
<CodebookCompID>29</CodebookCompID>
<CodebookID>8</CodebookID>
<OptionID>29</OptionID>
<OptionPosition>1</OptionPosition>
<OptionValue>0</OptionValue>
</_x0033_2_CodebookOptionMap>
<_x0033_2_CodebookOptionMap>
<CodebookCompID>30</CodebookCompID>
<CodebookID>8</CodebookID>
<OptionID>30</OptionID>
<OptionPosition>2</OptionPosition>
<OptionValue>1</OptionValue>
</_x0033_2_CodebookOptionMap>
<_x0033_2_CodebookOptionMap>
<CodebookCompID>31</CodebookCompID>
<CodebookID>8</CodebookID>
<OptionID>31</OptionID>
<OptionPosition>3</OptionPosition>
<OptionValue>2</OptionValue>
</_x0033_2_CodebookOptionMap>
<_x0033_2_CodebookOptionMap>
<CodebookCompID>32</CodebookCompID>
<CodebookID>8</CodebookID>
<OptionID>32</OptionID>
<OptionPosition>4</OptionPosition>
<OptionValue>3</OptionValue>
</_x0033_2_CodebookOptionMap>
<_x0033_2_CodebookOptionMap>
<CodebookCompID>33</CodebookCompID>
<CodebookID>9</CodebookID>
<OptionID>33</OptionID>
<OptionPosition>1</OptionPosition>
<OptionValue>0</OptionValue>
</_x0033_2_CodebookOptionMap>
<_x0033_2_CodebookOptionMap>
<CodebookCompID>34</CodebookCompID>
<CodebookID>9</CodebookID>
<OptionID>34</OptionID>
<OptionPosition>2</OptionPosition>
<OptionValue>1</OptionValue>
</_x0033_2_CodebookOptionMap>
<_x0033_2_CodebookOptionMap>
<CodebookCompID>35</CodebookCompID>
<CodebookID>9</CodebookID>
<OptionID>35</OptionID>
<OptionPosition>3</OptionPosition>
<OptionValue>2</OptionValue>
</_x0033_2_CodebookOptionMap>
<_x0033_2_CodebookOptionMap>
<CodebookCompID>36</CodebookCompID>
<CodebookID>9</CodebookID>
<OptionID>36</OptionID>
<OptionPosition>4</OptionPosition>
<OptionValue>3</OptionValue>
</_x0033_2_CodebookOptionMap>
<_x0033_2_CodebookOptionMap>
<CodebookCompID>37</CodebookCompID>
<CodebookID>10</CodebookID>
<OptionID>37</OptionID>
<OptionPosition>1</OptionPosition>
<OptionValue>0</OptionValue>